{
 "counts": {
  "failed": 0,
  "total": 0,
  "waiting": 0
 },
 "items": [],
 "sources": {
  "erp": {
   "detail": "",
   "state": "off",
   "ts": 1761599990
  },
  "gh": {
   "detail": "",
   "state": "ok",
   "ts": 1761599990
  },
  "herdr": {
   "detail": "",
   "state": "ok",
   "ts": 1761599990
  },
  "mail": {
   "detail": "no local store",
   "state": "unavailable",
   "ts": 1761599990
  },
  "notif": {
   "detail": "",
   "state": "ok",
   "ts": 1761599990
  },
  "ops": {
   "detail": "",
   "state": "ok",
   "ts": 1761599990
  },
  "task": {
   "detail": "",
   "state": "ok",
   "ts": 1761599990
  }
 },
 "ts": 1761599990,
 "v": 1
}
